<?xml version="1.0" encoding="UTF-8"?>
<replacementRoot xmlns="http://www.w3schools.com"
	xmlns:xsi="http://www.w3.org/2001/XMLSchema-instance" xsi:schemaLocation="replacement_rule.xsd"
	objName="dto" templateLocation="../code_templates/DTOTemplate.jav"
	objectType="codegen.modelobjects.DTO">
	<fileName value="@dto/dto.getName()+@.java" />
	<replacement name="name" value="dto.getName()" />
	<replacement name="description" value="dto.getDescription()" />
	<replacementSet subObjName="prop" name="properties"
		value="dto.getProperties().entrySet()">
		<replacement name="propDesc" value="prop.getValue().getDescription()" />
		<replacement name="propertyName" value="prop.getKey()" />
		<replacement name="propertyType" value="prop.getValue().getType()" />
	</replacementSet>
</replacementRoot>
